{
  "id": "whisper-transcribe",
  "name": "Whisper Transcriber",
  "entry": "whisper_transcribe.py",
  "path": "scripts/whisper_transcribe.py",
  "version": "1.0.0",
  "author": "PiSaucer",
  "license": "MIT",
  "language": "python",
  "category": "audio",
  "platforms": ["Linux", "MacOS", "Windows"],
  "description": "Find audio files without transcripts and transcribe them with Whisper.",
  "long_description": "Recursively scans a directory for supported audio files, skips files that already have a matching Whisper transcript, loads the selected Whisper model once, and transcribes only unfinished recordings. Supports TXT, VTT, SRT, TSV, and JSON output, optional language selection, custom audio extensions, dry-run mode, and a shared output directory.",
  "requirements": [
    "Python 3.9+",
    "Python package: openai-whisper",
    "ffmpeg"
  ],
  "tags": [
    "Whisper",
    "Audio",
    "Transcription",
    "MP3",
    "Speech",
    "Text"
  ],
  "usage": [
    "python3 whisper_transcribe.py ./recordings",
    "python3 whisper_transcribe.py ./recordings --model large-v3",
    "python3 whisper_transcribe.py ./recordings --language en --output-format txt",
    "python3 whisper_transcribe.py ./recordings --formats mp3,m4a,wav --dry-run"
  ]
}
