{
  "id": "generate-sitemap",
  "name": "Sitemap Generator",
  "entry": "generate_sitemap.py",
  "path": "scripts/generate_sitemap.py",
  "version": "1.2.1",
  "author": "PiSaucer",
  "license": "MIT",
  "language": "python",
  "category": "web",
  "platforms": ["Linux", "MacOS", "Windows"],
  "description": "Generate a standards-compliant sitemap.xml from a directory of HTML files.",
  "long_description": "Recursively finds HTML and HTM files, converts their relative paths to encoded public URLs, supports clean directory URLs and glob-based exclusions, includes each file's UTC modification time, escapes XML-sensitive characters, and writes a sitemap.xml file for search-engine indexing.",
  "requirements": ["Python 3.10+"],
  "tags": ["Sitemap", "XML", "HTML", "SEO", "Web"],
  "usage": [
    "python3 generate_sitemap.py --root ./site --base-url https://example.com/",
    "python3 generate_sitemap.py --root ./public --base-url https://example.com/docs/ --pretty-urls",
    "python3 generate_sitemap.py --root ./site --base-url https://example.com/ --output ./dist/sitemap.xml --exclude 'private/*.html'"
  ]
}
